,postNum,currPostUrl,response_title,response_post,response_numComment,response_rating
0,1,https://habr.com/ru/post/1,Wiki-FAQ для Хабрахабра,"<div class=""post__text post__text-html post__text_v1"" id=""post-content-body"">Привет!<br/> <br/> Для сборника ответов на Часто Задаваемые Вопросы мы решили использовать идею wiki, поскольку, как нам кажется, нет смысла писать одному конкретному человеку FAQ для такого сайта, как Хабрахабр. Все равно останутся люди, у которых останутся вопросы.<br/> Посему, обращаюсь к читателям группы со следующим вопросом: какой wiki-движок из доступных, по-вашему, идеально подходит для составления «коллективного» ЧАВО по сайту?<br/> </div>",63,1
1,2,https://habr.com/ru/post/2,Мы знаем много недоделок на сайте… но!,"<div class=""post__text post__text-html post__text_v1"" id=""post-content-body"">Кроме неработающих и отсутствующих страниц, о которых мы знаем, есть ошибки о которых мы ничего не знаем. Чем они отличаются? Хм… трудный вопрос. Пишите обо всем, а мы разберемся! =) И ничего не забудем.<br/> <br/> Хабрахабр!</div>",37,0
2,3,https://habr.com/ru/post/3,Чтение RSS-потоков,"<div class=""post__text post__text-html post__text_v1"" id=""post-content-body"">Какими службами пользуетесь для чтения RSS-потоков? Почему? В чем плюсы и минусы?<br/> <br/> Я остановился на Яндес.Лента. Плюсов масса, минус один — днем, в часы пик, сайт часто «лежит», а если не лежит — долго откликается.<br/> </div>",21,1
3,4,https://habr.com/ru/post/4,"Маслов, Сокур и партнеры пиарят Google в России","<div class=""post__text post__text-html post__text_v1"" id=""post-content-body"">Насколько я знаю, Google выбрал агентство <a href=""http://www.msapr.ru"">«Маслов, Сокур и партнеры»</a> для pr-сопровождения в России на местном рынке. Недавно они провели <a href=""http://www.cnews.ru/news/top/index.shtml?2006/07/12/205812"">неформальную встречу с журналистами</a>, а сегодня в Ведомостях была опубликована статья-страшилка: <a href=""http://www.vedomosti.ru/newspaper/article.shtml?2006/07/14/109591"">«Рамблер должен бояться»</a>.</div>",15,1
